Nombre;Descripción Corta;Ubicación;Descripción
Centro Comercial Portal del Quindío.;El Centro Comercial Portal del Quindio, ubicado en el norte de Armenia, es el centro comercial, más grande e importante del Quindío.;Dirección: Av Bolivar # 19 Norte 46 Armenia;"El Centro Comercial Portal del Quindio, ubicado en el norte de Armenia, es el centro comercial, más grande e importante del Quindío. Cuenta con 100 locales donde se encuentran representadas las marcas comerciales nacionales e internacionales más importantes.En su mall de comidas rápidas encontrará reconocidos restaurantes como Frisby, hamburguesas El Corral y Presto entre otras.Todo esta oferta se complementa con una espectacular diverzona y cuatro (4) modernas salas de Cinecolombia."
Unicentro - Armenia.;Unicentro Armenia inaugurado en Septiembre de 2.012,  ubicado en la  esquina de la Avenida Bolívar con la Calle 4B ;Avenida Bolívar con Calle 4B;"Unicentro Armenia inaugurado en Septiembre de 2.012,  ubicado en la  esquina de la Avenida Bolívar con la Calle 4B donde antiguamente funcionó la fabrica de Bavaria, a pocos minutos del Centro de Armenia.El centro comercial cuenta con 40 mil metros cuadrados, 129 locales comerciales y 410 parqueaderos.Entre las marcas comerciales que ya confirmarón su presencia en Unicentro Armenia, se destacan: Almacenes Exito, Pepe Ganga, Recreatec, Arturo Calle, entre otros."
Calima Centro Comercial Armenia;Calima Armenia nace de la necesidad de la ciudad y la región de abrir nuevos espacios comerciales para atender un mercado creciente;Avenida Centenario # 3 - 180. Armenia;Calima Armenia nace de la necesidad de la ciudad y la región de abrir nuevos espacios comerciales para atender un mercado creciente. Un proyecto con sentido ambiental, hace énfasis en su diseño bioclimático de arquitectura abierta que optimiza el uso de la energía. Calima, un verdadero modelo de sostenimiento, será desarrollado en amplios espacios para atender necesidades comerciales, de servicios, entretenimiento y parqueo.
Parque del Café;El Parque del Café  brinda a sus visitantes diversión y entretenimiento a través de la cultura cafetera;Montenegro Quindio;El Parque del Café  brinda a sus visitantes diversión y entretenimiento a través de la cultura cafetera, dando a conocer la importancia del café y del gremio cafetero en el desarrollo económico del país, en un ambiente de naturaleza, con innovadoras, confiables y seguras atracciones  culturales y mecánicas, comprometidos con la conservación del medio ambiente, el bienestar de nuestros empleados y el de la comunidad.
Panaca;Somos el primer parque temático agropecuario en el mundo y el más grande en Latinoamérica;Kilometro 7, Vía Vereda Kerman Quimbaya, Quindío.;Somos el primer parque temático agropecuario en el mundo y el más grande en Latinoamérica, te ofrecemos una experiencia única llena de diversión e interacción con el campo, en la que podrás encontrar los Shows más sorprendentes, las más impresionantes Estaciones temáticas y la colección de zoología doméstica más grande del mundo, donde vivirás una experiencia inigualable entre los animales, la naturaleza y el hombre.
Salento;Salento es un municipio colombiano en el departamento del Quindío.;Municipio en Colombia;"Salento es un municipio colombiano en el departamento del Quindío. Llamado el padre del Quindío por ser el municipio más antiguo de este departamento, es conocido como el municipio Cuna del árbol Nacional ""La Palma de Cera"", posee una gran variedad de atractivos turísticos entre ellos el Valle de Cocora en donde se puede encontrar un paisaje lleno de naturaleza, como el Barranquero o Momotus momota un ave comúnmente divisada, hacer caminatas ecológicas y disfrutar de los hermosos paisajes de esta localidad. "
Eco Parque Peñas Blancas;ofrece un recorrido lleno de aire, naturaleza y paisaje;Corregimiento la virginia en Calarcá;"EL ECOPARQUE PEÑAS BLANCAS ofrece un recorrido lleno de aire, naturaleza y paisaje, el cual nos transporta por los parajes más bellos de nuestra región, entre un bosque lleno de verde que parece infinito al contemplar la hoya del Quindío e inalcanzable al observarla inmensa mole blanca y rocosa que sobresale en la montaña."
La Pequeña Granja de Mamá Lulú;La Pequeña Granja de Mamá Lulú, es un paraíso ecológico ;Quimbaya Quindio;La Pequeña Granja de Mamá Lulú, es un paraíso ecológico que a través de años de estudio, esfuerzo y dedicación, ha permitido crear un ambiente en donde se integran el hombre y la naturaleza en armonía y cooperación. La propuesta que busca esta granja integral, es generar un cambio de actitud personal hacia la vida y la naturaleza, para no seguirla agrediendo, no seguir acabando con nuestros recursos y destruir todo a nuestro paso.
La Pequeña Granja de Mamá Lulú;La Pequeña Granja de Mamá Lulú, es un paraíso ecológico ;Quimbaya Quindio;La Pequeña Granja de Mamá Lulú, es un paraíso ecológico que a través de años de estudio, esfuerzo y dedicación, ha permitido crear un ambiente en donde se integran el hombre y la naturaleza en armonía y cooperación. La propuesta que busca esta granja integral, es generar un cambio de actitud personal hacia la vida y la naturaleza, para no seguirla agrediendo, no seguir acabando con nuestros recursos y destruir todo a nuestro paso.
Parque Los Arrieros ;EL Parque Los Arrieros es un lugar que ofrece servicios turísticos de recreación;Quimbaya Quindio;"EL Parque Los Arrieros es un lugar que ofrece servicios turísticos de recreación, esparcimiento y aprendizaje; en torno a la cultura de la arriería; a través de escenarios artísticos, culturales y áreas de entretenimiento que conforman un abanicó de opciones para que los visitantes, disfruten de una agradable experiencia en nuestras instalaciones."
